{"sourceSystem":"synthetic-observability","sourceTool":"getRecentServiceErrors","retrievedAt":"2026-10-05T12:00:00Z","correlationId":"0bb7c2ad-f515-40f0-9185-0e44357534c0","toolCallId":"4e7349ed-5d13-4e3a-b0a6-2b2874d6e28f","status":"NOT_FOUND","contentSchemaVersion":"service-errors/v1","statusDetail":"No recorded source reference."}
